{"$schema":"https://schema.secuarden.ai/stage1/2.0/event.schema.json","schema_version":"2.0.0","id":"99999999-9999-4999-8999-999999999999","session_id":"reconciliation-session","sequence":4,"timestamp":"2026-07-31T02:00:03Z","captured_at":"2026-07-31T02:00:03Z","invocation_id":"toolu_post_only_01","source":"secuarden-cli","source_version":"2.1.0","agent_name":"claude-code","hook_phase":"post","action_type":"mcp_tool_use","tool_name":"mcp__docs__lookup","outcome":"success","permission_status":"unknown","execution_status":"completed","privacy_mode":"metadata_only","is_sensitive":false,"redacted_fields":[],"mcp_server":"docs","mcp_tool":"lookup","raw_event_hash":"4444444444444444444444444444444444444444444444444444444444444444","completeness":{"state":"complete","reasons":[]}}
