{"$schema":"https://schema.secuarden.ai/stage1/2.0/event.schema.json","schema_version":"2.0.0","id":"77777777-7777-4777-8777-777777777777","session_id":"reconciliation-session","sequence":2,"timestamp":"2026-07-31T02:00:01Z","captured_at":"2026-07-31T02:00:01Z","invocation_id":"toolu_correlated_01","source":"secuarden-cli","source_version":"2.1.0","agent_name":"claude-code","hook_phase":"post","action_type":"file_read","tool_name":"Read","outcome":"success","permission_status":"unknown","execution_status":"completed","privacy_mode":"metadata_only","is_sensitive":false,"redacted_fields":[],"file_path":"README.md","raw_event_hash":"2222222222222222222222222222222222222222222222222222222222222222","completeness":{"state":"complete","reasons":[]}}
