{"$schema":"https://schema.secuarden.ai/stage1/2.0/event.schema.json","schema_version":"2.0.0","id":"88888888-8888-4888-8888-888888888888","session_id":"reconciliation-session","sequence":3,"timestamp":"2026-07-31T02:00:02Z","captured_at":"2026-07-31T02:00:02Z","invocation_id":"toolu_pre_only_01","source":"secuarden-cli","source_version":"2.1.0","agent_name":"claude-code","hook_phase":"pre","action_type":"command_exec","tool_name":"Bash","outcome":"pending","permission_status":"unknown","execution_status":"not_started","privacy_mode":"metadata_only","is_sensitive":false,"redacted_fields":[],"raw_event_hash":"3333333333333333333333333333333333333333333333333333333333333333","completeness":{"state":"complete","reasons":[]}}
