{"$schema":"https://schema.secuarden.ai/stage1/2.0/event.schema.json","schema_version":"2.0.0","id":"66666666-6666-4666-8666-666666666666","session_id":"reconciliation-session","sequence":1,"timestamp":"2026-07-31T02:00:00Z","captured_at":"2026-07-31T02:00:00Z","invocation_id":"toolu_correlated_01","source":"secuarden-cli","source_version":"2.1.0","agent_name":"claude-code","hook_phase":"pre","action_type":"file_read","tool_name":"Read","outcome":"pending","permission_status":"unknown","execution_status":"not_started","privacy_mode":"metadata_only","is_sensitive":false,"redacted_fields":[],"file_path":"README.md","raw_event_hash":"1111111111111111111111111111111111111111111111111111111111111111","completeness":{"state":"complete","reasons":[]}}
