{"$schema":"https://schema.secuarden.ai/stage1/2.0/event.schema.json","schema_version":"2.0.0","id":"44444444-4444-4444-8444-444444444444","session_id":"partial-session","sequence":2,"timestamp":"2026-07-31T01:02:04Z","captured_at":"2026-07-31T01:02:04Z","source":"secuarden-cli","source_version":"2.1.0","agent_name":"claude-code","hook_phase":"post","action_type":"file_read","tool_name":"Read","outcome":"success","permission_status":"unknown","execution_status":"completed","privacy_mode":"metadata_only","is_sensitive":false,"redacted_fields":[],"raw_event_hash":"dddddddddddddddddddddddddddddddddddddddddddddddddddddddddddddddd","completeness":{"state":"partial","reasons":["missing_invocation_id"]}}
