{"$schema":"https://schema.secuarden.ai/stage1/2.0/event.schema.json","schema_version":"2.0.0","id":"33333333-3333-4333-8333-333333333333","session_id":"partial-session","sequence":1,"timestamp":"2026-07-31T01:02:03Z","captured_at":"2026-07-31T01:02:03Z","source":"secuarden-cli","source_version":"2.1.0","agent_name":"claude-code","hook_phase":"pre","action_type":"file_read","tool_name":"Read","outcome":"pending","permission_status":"unknown","execution_status":"not_started","privacy_mode":"metadata_only","is_sensitive":false,"redacted_fields":[],"raw_event_hash":"cccccccccccccccccccccccccccccccccccccccccccccccccccccccccccccccc","completeness":{"state":"partial","reasons":["missing_invocation_id"]}}
