{"$schema":"https://schema.secuarden.ai/stage1/2.0/event.schema.json","schema_version":"2.0.0","id":"11111111-1111-4111-8111-111111111111","session_id":"claude-session-1","sequence":2,"timestamp":"2026-07-31T01:02:03Z","captured_at":"2026-07-31T01:02:04Z","invocation_id":"toolu_01ABC","source":"secuarden-cli","source_version":"2.1.0","agent_name":"claude-code","agent_version":"1.0.0","model":"claude-sonnet-4","provider":"anthropic","hook_phase":"post","action_type":"file_write","tool_name":"Edit","outcome":"success","permission_status":"unknown","execution_status":"completed","privacy_mode":"redacted_content","is_sensitive":false,"redacted_fields":[],"file_path":"internal/example.go","content_hash":"aaaaaaaaaaaaaaaaaaaaaaaaaaaaaaaaaaaaaaaaaaaaaaaaaaaaaaaaaaaaaaaa","diff_stats":"+2/-1","raw_event_hash":"bbbbbbbbbbbbbbbbbbbbbbbbbbbbbbbbbbbbbbbbbbbbbbbbbbbbbbbbbbbbbbbb","completeness":{"state":"complete","reasons":[]}}
